{
  "fixture_id": "L2-F059",
  "title": "Degraded quality with partial coverage",
  "family": "quality",
  "purpose": "Keep observation quality and coverage separate from pattern confidence.",
  "source_platform_class": "Wear OS watch",
  "records": [
    {
      "schema_version": "ppf-l2/1",
      "event_id": "L2-F059-E1",
      "event_type": "activity.motion",
      "source": {
        "platform": "WEAR_OS",
        "device_class": "WATCH",
        "provider": "wear-sensor",
        "source_event_id": "src-L2-F059-1"
      },
      "time": {
        "phenomenon_time": {
          "start": "2026-08-10T08:00:00Z",
          "timing_quality": "KNOWN"
        },
        "result_or_observed_time": "2026-08-10T08:00:05Z",
        "ingested_time": "2026-08-10T08:00:10Z"
      },
      "evidence_kind": "RAW_OBSERVATION",
      "observability": {
        "state": "OBSERVED_OCCURRENCE"
      },
      "context": {},
      "quality": {
        "quality_state": "DEGRADED",
        "coverage_state": "PARTIAL",
        "details": {
          "reason": "intermittent_sensor_contact"
        }
      },
      "provenance": {
        "procedure_status": "NOT_APPLICABLE"
      },
      "payload": {
        "observation": "activity.motion"
      },
      "capture_policy": {
        "mode": "PASSIVE_WEARABLE",
        "expected_observability": "EXPECTED"
      }
    }
  ],
  "expected": {
    "semantic_interpretation": "The event remains an occurrence while its observation quality and coverage are degraded/partial.",
    "observability": "Occurrence was observed, but evidence quality is degraded.",
    "opportunity": "No opportunity claim is required for this fixture.",
    "time": "Phenomenon, observation/result, and ingestion times remain distinct fields.",
    "provenance": "Source identity and capture/procedure provenance remain explicit.",
    "multi_device": "No cross-device relationship is asserted.",
    "raw_derived": "Quality metadata describes evidence only and is not a pattern confidence score.",
    "lineage": "No correction, deletion, or supersession is asserted.",
    "must_not_infer": "Do not convert observation quality into pattern confidence or a recognition decision."
  },
  "adversarial": true,
  "gates": [
    "L2-G5",
    "L2-G16"
  ]
}
